{"id":"business-plan","title":"Write a business plan","description":"Product assumptions (price, growth, churn) drive a live 12-month revenue projection, plus a category budget — change an assumption and the model recomputes.","version":"1.0.0","license":"CC0-1.0","author":{"name":"GalLahat"},"tags":["business","finance","projection","formulas"],"icon":"icon.png"}
