{"id":"student","title":"Manage your semester","description":"A full student command center: courses, an exam calendar by topic, assignments, syllabus mastery tracking, and lecture notes for every class.","version":"1.0.0","license":"CC0-1.0","author":{"name":"GalLahat"},"tags":["student","study","school","notes"],"icon":"icon.png"}
