{"id":"project-plan","title":"Plan a company project","description":"A full multi-department initiative: phased task tree with rolled-up effort, milestones, team, and risks — board, calendar, and table views.","version":"1.0.0","license":"CC0-1.0","author":{"name":"GalLahat"},"tags":["project","company","planning","formulas"],"icon":"icon.png"}
