{"id":"second-brain","title":"Build a second brain","description":"A growing web of atomic notes and ideas connected by page references — mental models, learning, productivity, and creativity, all cross-linked.","version":"1.0.0","license":"CC0-1.0","author":{"name":"GalLahat"},"tags":["notes","knowledge","zettelkasten","pkm"],"icon":"icon.png"}